{
  "slug": "dual-runner-claim-a",
  "title": "Dual runner claim A",
  "lifecycle": {
    "stage": "executing",
    "updated_at": "2026-03-20T09:00:00Z"
  },
  "planning_owner": null,
  "execution_owner": {
    "runner": "codex",
    "session_id": "codex-claim-001"
  },
  "worktree": {
    "branch": "codex/dual-runner-claim-a",
    "worktree_path": "/worktrees/dual-runner-claim-a",
    "binding_status": "bound",
    "bound_at": "2026-03-20T08:50:00Z"
  },
  "lease": {
    "runner": "codex",
    "session_id": "codex-claim-001",
    "branch": "codex/dual-runner-claim-a",
    "worktree_path": "/worktrees/dual-runner-claim-a",
    "claimed_feature": "dual-runner-claim-a",
    "claimed_tasks": [1],
    "claimed_at": "2026-03-20T08:50:00Z",
    "last_heartbeat": "2026-03-20T09:00:00Z",
    "expires_at": "2026-03-20T10:50:00Z"
  },
  "docs": {},
  "tasks": [
    {
      "id": 1,
      "title": "Keep the lease stable",
      "status": "claimed",
      "owner_session_id": "codex-claim-001",
      "path": ".claude/cx/core/features/dual-runner-claim-a/tasks/1.md"
    },
    {
      "id": 2,
      "title": "Verify a second session stays isolated",
      "status": "ready",
      "owner_session_id": null,
      "path": ".claude/cx/core/features/dual-runner-claim-a/tasks/2.md"
    }
  ],
  "handoffs": []
}
