{
  "slug": "dual-runner-handoff",
  "title": "Dual runner handoff",
  "lifecycle": {
    "stage": "executing",
    "updated_at": "2026-03-20T09:00:00Z"
  },
  "planning_owner": null,
  "execution_owner": {
    "runner": "cc",
    "session_id": "cc-source-001"
  },
  "worktree": {
    "branch": "cc/dual-runner-handoff",
    "worktree_path": "/worktrees/dual-runner-handoff",
    "binding_status": "bound",
    "bound_at": "2026-03-20T08:40:00Z"
  },
  "lease": {
    "runner": "cc",
    "session_id": "cc-source-001",
    "branch": "cc/dual-runner-handoff",
    "worktree_path": "/worktrees/dual-runner-handoff",
    "claimed_feature": "dual-runner-handoff",
    "claimed_tasks": [1, 2],
    "claimed_at": "2026-03-20T08:40:00Z",
    "last_heartbeat": "2026-03-20T09:00:00Z",
    "expires_at": "2026-03-20T10:40:00Z"
  },
  "docs": {},
  "tasks": [
    {
      "id": 1,
      "title": "Source runner hands off cleanly",
      "status": "claimed",
      "owner_session_id": "cc-source-001",
      "path": ".claude/cx/core/features/dual-runner-handoff/tasks/1.md"
    },
    {
      "id": 2,
      "title": "Target runner can continue after transfer",
      "status": "claimed",
      "owner_session_id": "cc-source-001",
      "path": ".claude/cx/core/features/dual-runner-handoff/tasks/2.md"
    }
  ],
  "handoffs": []
}
